{
  "$schema": "https://json-schema.org/draft/2020-12/schema",
  "$id": "https://metaplus.dev/json-schemas/metaplus_doc.json",
  "title": "MetaplusDoc",
  "description": "Canonical document envelope that separates stable identity, source-aligned metadata, derived enrichments, and edit bookkeeping.",
  "type": "object",
  "properties": {
    "idea": {
      "description": "Stable identity section containing FQMN and its decomposed parts.",
      "$ref": "base.json#/$defs/idea"
    },
    "meta": {
      "description": "Source-aligned metadata synchronized from authoritative systems.",
      "type": "object"
    },
    "plus": {
      "description": "Derived, human-authored, or AI-generated enrichments kept separate from source facts.",
      "type": "object"
    },
    "edit": {
      "description": "Document-level edit bookkeeping for meta and plus sections.",
      "$ref": "base.json#/$defs/edit"
    }
  },
  "required": ["idea", "meta", "plus"],
  "additionalProperties": false
}
